Category	Question	Choice-1	Choice-2	Choice-3	Choice-4	Answer
People	Knute is perhaps the most famous name in college football but it was not Coach Rocknes real first name.	False	True			False
People	Duke, Dizzy, Peewee,  Satchel, Whitey, Yogi: all of these famous baseball handles were nicknames, except for one, which was a given first name.	True	False			False
People	What was the nickname of Byron White, the only professional football player ever appointed to the Supreme Court?	Whitey	Ambulance Chaser	Whiz Kid	Whizzer	Whizzer
People	What was the real name of Connie Mack, the legendary manager of the Philadelphia As?	Connie MacDonald	Casey McDonald	Cornelius Macdougal	Cornelius McGillicuddy	Cornelius McGillicuddy
People	The three DiMaggio brothers, who played major league baseball at the same time, were actually born with which of the following names?	Joseph, Dominico, Vincente	Guido, Dom, Vincenzo	Guiseppe, Dominic, Vincent	Chico, Zeppo, Irving	Guiseppe, Dominic, Vincent
People	The Alous, with four family members in the MLB, may lineup as baseballs most impressive brood, but only one Alou boasts even the hint of a nickname. What is it?	Mo	Jessie	Matty	Marty	Matty
People	Which of the boxing champions below carried a name into the ring most different from his actual birth name?	Jack Dempsey	Sugar Ray Robinson	Max Baer	Rocky Marciano	Sugar Ray Robinson
People	Is it true that Pancho Segura and Pancho Gonzalez, who were both kings on the tennis court,  were christened with the same first name.	No	Yes			No
People	Rather than be paraded through the streets of Rome, this queen chose to die from the bite of an asp.	Cleopatra	Berenice	Nefertiti	Boadicea	Cleopatra
People	Name the cult leader of the Peoples Temple who was responsible for the suicide/murder of over 900 members of the Peoples Temple on November 18th 1978.	Jim Jones	Donald Cinque DeeFreeze	Randy Weaver	David Koresh	Jim Jones
People	This former German journalist helped Andreas Baader escape imprisonment and formed the Red Army Fraction. What German terrorist and author of The Concept of the Urban Guerrilla hanged herself on May 9, 1976?	Eva Haule	Irmgard Moller	Ulrike Meinhof	Gudrun Ensslin	Ulrike Meinhof
People	I feel certain that I am going mad again. I feel we cant go through another of those terrible times. What British author, played by Nicole Kidman, in The Hours, filled her pockets with stones and walked into a river near her home?	Virgina Woolf	Gertrude Stein	Sara Teasdale	Alice B. Toklas	Virgina Woolf
People	Sigmund Freud, the Father of Psychoanalysis, committed suicide on September 23, 1939.	False	True			True
People	This authors novel The Bell Jar was based on her own mental breakdown while a student at Smith. What author of Ariel and Winter Trees, killed herself by placing her head in a gas oven?	Sylvia Plath	Elizabeth Bishop	Sara Teasdale	Anne Sexton	Sylvia Plath
People	Razors pain you;	Mark Twain	Sara Teasdale	Dorothy Parker	Oscar Wilde	Dorothy Parker
People	On September 11, 2001 Flight # 93 had forty crew members and passengers whose brave actions saved America from one more unspeakable terror on that day of horror. Lisa Jefferson, a customer representative, was on the telephone with one of the passengers and reported his comments as the passengers tried to take back the plane. Whose cry of Lets roll became a rallying cry for the nation?	Mark Bingham	Jeremy Glick	Edward Felt	Todd Beamer	Todd Beamer
People	On September 11, 2001 according to U.S. Today 3,949 planes were in the air space over the United States when, for the first time in United States history, all air traffic was stopped. Though often overlooked, air controllers brought the planes and passengers down safely to the nearest airport. How long did it take for the air controllers to get everyone safely on the ground?	About two hours	About five hours	About three hours	About four hours	About three hours
People	Nicknamed The Splendid Splinter, this Hall of Fame baseball player interrupted his career twice to serve in World War II and the Korean War.	Ted Williams	Yogi Berra	Jackie Robinson	Mickey Mantle	Ted Williams
People	Stepping in to head The Washington Post after the death of her husband, this lady took her fight to publish the Pentagon Papers all the way to the United States Supreme Court. But it was her backing of two unknown reporters, Carl Bernstein and Bob Woodward, that helped change the course of American history. Who was Attorney General John Mitchell referring to when he said to tell her she was gonna get her *** caught in a big fat wringer if thats published?	Christie Hughes	Elisabeth Murdoch	Anne Cox Chambers	Katherine Graham	Katherine Graham
People	On October 20, 1973 in an effort to keep the Watergate tapes from the office of Special Prosecutor, Archibald Cox, President Richard Nixon ordered his  Attorney General to fire Archibald Cox. What was the name of the Attorney General who resigned rather than break his word to congress that the White House would not interfere with the investigation?	Elliot Richardson	John Sirica	Daniel Ellsberg	John Dean	Elliot Richardson
People	I felt a determination cover my body like a quilt in winter , is how this lady described her feelings when she confronted bus driver James Blake. She was later called Mother of the Civil Rights Movement.	Coretta Scott King	Myrlie Evers	Shirley Chisholm	Rosa Parks	Rosa Parks
People	The engineer of engine # 382 was trying to make up 95 minutes of lost time when he rounded an s-curve to find four cars of  a passenger train stalled on the track. Shouting at the fireman to jump, the engineer began to brake the train. What is the name of the engineer who rode engine # 382 to his death in order to save the passengers on the stalled train?	John Henry	Casey Jones	Alvin York	Johnny Chapman	Casey Jones
People	Who was the 8th President of the United States?	Andrew Jackson	James Monroe	Martin Van Buren	Andrew Johnson	Martin Van Buren
People	James Buchanan was a Republican.	False	True			False
People	Which of the following U.S. presidents was not assassinated while in office?	John F. Kennedy	William McKinley	Abraham Lincoln	Franklin D. Roosevelt	Franklin D. Roosevelt
People	George W. Bush became the 42nd President of the United States.	False	True			False
People	The 37th U.S. President, Richard Nixon was impeached due to the Watergate scandal.	True	False			False
People	Lyndon B. Johnson, who served as vice-president under John F. Kennedy, was sworn into office the day after President Kennedy was shot.	False	True			False
People	Which of these U.S. presidents was in office less than 1 year?	Millard Fillmore	John Tyler	John F. Kennedy	William Henry Harrison	William Henry Harrison
People	How many terms can a U.S. president serve?	2	4	1	3	2
People	Who served as the 23rd President of the United States?	Benjamin Harrison	Chester A. Arthur	James Garfield	William Mckinley	Benjamin Harrison
People	Who was the first U.S. president to serve over 12 years?	Grover Cleveland	Franklin D. Roosevelt	Theodore Roosevelt	George Washington	Franklin D. Roosevelt
People	Who was the father of Nicholas II of Russia?	Tsar Alexander II	Tsar Nicholas I	Tsar Alexander III	Tsar Peter	Tsar Alexander III
People	Empress Alexandra Fyodorovna was from which country?	Austria	Germany	England	Denmark	Germany
People	Both Nicholas II and Alexandra Fyodorovna were first cousins of King George V of England.	False	True			True
People	How many children did Nicholas II and his wife Alexandra have?	3	5	6	4	5
People	What language did Nicholas II and Alexandra Fyodorovna use in private conversation?	French	English	Russian	German	English
People	Nicholas II actually became Tsar of Russia before he married Alexandra.	True	False			True
People	When Nicholas abdicated the throne in 1917, he also abdicated for his heir, Alexis.	False	True			True
People	Alexandra Fyodorovnas sister was married to Nicholas IIs brother.	True	False			False
People	Who portrayed Rocky Balboa in the Rocky films?	Arnold Schwarzenegger	Sylvester Stallone	The Rock	Harrison Ford	Sylvester Stallone
People	Who played Dr. Frank N. Furter in the comedy-horror musical film The Rocky Horror Picture Show?	Jim Sharman	Barry Bostwick	Tim Curry	Richard OBrien	Tim Curry
People	What is the highest peak of the Rocky Mountains?	Mount Elbert	Mount Lincoln	Mount Harvard	Blanca Peak	Mount Elbert
People	This Rocky was killed in a plane crash on August 31, 1969.	Rocky DeSantos	Rocky Fain	Rocky Johnson	Rocky Marciano	Rocky Marciano
People	What are Rocky Mountain oysters?	Pine cones	Cow dung	Bull testicles	Shell fish	Bull testicles
People	Rocky Johnson, a former Canadian professional wrestler, is the father of what actor and former wrestler?	Tony Atlas	Junkyard Dog	The Rock	Bryan Clark	The Rock
People	Rocky Top is the official song of what US state?	Tennessee	Wyoming	Texas	Kentucky	Tennessee
People	Which Rocky was a former fullback for the Pittsburgh Steelers?	Rocky Martin	Rocky Bleier	Rocky Johnson	Rocky Balboa	Rocky Bleier
People	Rocky Road ice cream is traditionally composed of chocolate ice cream, nuts and what else?	pretzels	Caramel	Fudge	Marshmallows	Marshmallows
People	The following citation is taken from this novel of F. Scott Fitzgerald. 	Tender Is the Night	The Great Gatsby	The Beautiful and Damned	This Side of Paradise	The Great Gatsby
People	Winfield Scott was a United States lieutenant general, diplomat, and presidential candidate. In the 1852 presidential election, Scott was the unsuccessful Whig Party candidate, losing to this Democrat.	Franklin Pierce	John Tyler	William Henry Harrison	Millard Fillmore	Franklin Pierce
People	One of the following statements concerning the life and personality of Sir Walter Scott is wrong.	All of these statements are actually true.	He was the first author to have a truly international career in his lifetime.	He is sometimes known as the Great Magician.	He was a prolific Scottish historical novelist and poet.	All of these statements are actually true.
People	Just one of these could be the work of George Gilbert Scott.	Painting	Church	Symphony	Sculpture	Church
People	Jason Scott Lee is an Asian American movie actor. He starred in all these movies except one.	Tale of the Mummy	The Jungle Book	Ride the High Country	Soldier	Ride the High Country
People	Francis Scott Key was an American lawyer and amateur poet. One of his poems was added to already existing music, and the combination was adopted as the American national anthem in 1931. This is the name of the above-mentioned poem.	His poem did not have a name.	The Defence of Fort MHenry	To Anacreon in Heaven	The Star-Spangled Banner	The Defence of Fort MHenry
People	This Tracy, who won two Academy Awards, portrayed Captain Culpepper, Henry Drummond, Richard Sumner and Stanley Banks.	Oliver Tracy	Tracy Lord	Tracy Austin	Spencer Tracy	Spencer Tracy
People	This comedienne, named Tracey, hosted a weekly television variety show  which ended with the catchphrase Go Home.	Tracey Gold	Tracey Bergman	Tracey Harris	Tracey Ullman	Tracey Ullman
People	This actress, known for her performance in the TV series The Avengers, portrayed Tracy Bond in Her Majestys Secret Service.	Diana Smythe	Diana Rigg	Emma Peel	Kim Basinger	Diana Rigg
People	This Tracy, who was a cast member of Saturday Night Live, played recurring characters such as Dominican Lou, Mrs. Parker, Reggie Owens, Captain Munclair Vanderhousen III, and Tate Witherspoon.	Tracy Bergman	Tracy McGrady	Tracy Morgan	Tracy Austin	Tracy Morgan
People	Tracey E. Bergman played in which soap opera set in Genoa City, Wisconsin?	As the World Turns	The Young and the Restless	The Guiding Light	General Hospital	The Young and the Restless
People	Fast Car, Talkin Bout a Revolution, Baby Can I Hold You, and Give Me One Reason are some of the songs by this Tracy.	Tracy Ullman	Tracy Harris	Tracy Chapman	Spencer Tracy	Tracy Chapman
People	This cartoonist, famous for his colourful villains, is the creator of the comic strip detective Dick Tracy.	Dr. Suess	Charles Schultz	Chester Gould	Dwight Good	Chester Gould
People	This Tracy is the screenwriter and producer of such works as Saturday Night Live, Odyssey 5, Star Trek: The Next Generation and Fire in the Sky.	Tracy Bergman	Tracy Harris	Tracy Torme	Tracy Chapman	Tracy Torme
People	On the ABC sitcom Growing Pains, actress Tracey Gold portrayed which character?	Carol Seaver	Julie Costello	Maggie Seaver	Kate Macdonald	Carol Seaver
People	Who portrayed the wealthy Philadelphian socialite Tracy Lord in the 1940 movie The Philadelphia Story?	Leslie Caron	Priscilla Lane	Claudette Colbert	Katharine Hepburn	Katharine Hepburn
People	What does the female name Aba mean?	Born on a journey	Born in the wild	Born on a holy day	Born on a Thursday	Born on a Thursday
People	What is the meaning of the name Amy according to popular beliefs?	Favorite	Mild	Beloved	Pretty	Beloved
People	What is the meaning of the French female name Ariane?	Gracious	Fine	Holy	Graceful	Holy
People	What does the female name Aisha mean?	Eternal	Smooth	Alive	Faithful	Alive
People	What is the meaning of the name Barbara according to traditional beliefs?	Strange	Sleek	White	Black	Strange
People	What is the meaning of the name Jessica?	Gods blessing	Gods love	Gods anger	Gods grace	Gods grace
People	What does the Cornish name Kerensa mean?	Love and peace	Loyalty and devotion	Faith and strength	Care and kindness	Love and peace
People	What does the Hawaiian female name Malia mean ?	Brave and bold	Sweet and loving	Calm and peaceful	Faithful and devoted	Calm and peaceful
People	The surname Eriksson is in the top 5 of the most common names in which European country?	Denmark	Norway	UK	Sweden	Sweden
People	Of what origin is the popular surname OBrien?	British	Scottish	Irish	Swedish	Irish
People	According to the 2007 statistics of the Canadian Broadcasting Corporation, what is the most common surname in Canada?	Tremblay	Li	Wilson	Dubois	Li
People	Which of the following surnames is not of German origin?	Hoffmann	Meyer	Fischer	Roux	Roux
People	Cohen is the most common and respected Jewish surname of biblical origins borne by 2.52% of people in Israel. But being a Cohen has some disadvantages. Which of the following are people bearing this name forbidden by Jewish religious law?	To marry	To divorce	To participate in politics	To marry a divorced woman	To marry a divorced woman
People	Novak (Nowak) is a popular surname in which of the following countries?	Slovakia	Poland	All of these	Slovenia	All of these
People	Identify the line that contains only surnames typical for the Spanish-speaking countries.	González, Patel, Ruiz, Navarro, Ortiz	Martínez, Alonso, Lopez, Gil, Morales	Pérez, Mészáros, Díaz, Sanz, Molina	Vázquez, Serrano, Ortiz, Ferreira, Delgado	Martínez, Alonso, Lopez, Gil, Morales
People	Of what origin is the surname Kerr?	German	French	Belgian	Scottish	Scottish
People	If your surname was De Jong, your home country would most probably be this one.	The Netherlands	Denmark	Sweden	Japan	The Netherlands
People	Which of these is the most widespread surname in the world by number of people bearing it?	Smith	Ivanov	Rodriguez	Li	Li
People	Who were Princess Dianas parents?	The Earl and Countess Spencer	The Viscount and Viscountess Althorp	The Earl and Countess of Althorp	The Duke and Duchess of Althorp	The Viscount and Viscountess Althorp
People	Princess Diana had one brother and one sister.	True	False			False
People	Princess Diana of Wales was actually born on one of the royal estates.	False	True			True
People	Princess Diana had no American ancestors.	True	False			False
People	What was Princess Dianas job prior to her marriage?	waitress at Harrods	governess	teachers assistant	socialite	teachers assistant
People	Where is Princess Diana buried?	Balmoral Castle	Highgrove House	Althorp Park	Kensington Palace	Althorp Park
People	What spot became the unofficial memorial of Princess Diana in Paris?	The Champ de Mars	The fountains at La Place du Trocadero	The small Statue of Liberty on an island in the Seine	The replica of the Torch of the Statue of Liberty on the Place dAlma	The replica of the Torch of the Statue of Liberty on the Place dAlma
People	Princess Dianas sister dated Prince Charles, before Diana and Charles became engaged.	True	False			True
People	The teddy bear toy is named after former president Theodore Roosevelt.	True	False			True
People	Franklin Delano Roosevelt became the first U.S. President to serve more than two terms.	True	False			True
People	Franklin as President was best remembered for implementing this program, which many believe ended the Great Depression.	The New Way	The New Deal	The New America	The New World Order	The New Deal
People	President Theodore Roosevelt walked Eleanor down the aisle on her wedding day.	True	False			True
People	Theodore Roosevelts first wife, Alice, and his mother, Martha, died on the same day.	True	False			True
People	Both Theodore Roosevelt and Franklin D. Roosevelt were democrats.	True	False			False
People	Throughout her husbands presidency, Eleanor Roosevelt often ranked higher in popularity polls than Franklin did.	False	True			True
People	Franklin Delano Roosevelt is one of the presidents depicted on Mount Rushmore in South Dakota.	True	False			False
People	Which state was admitted into the union during Theodore Roosevelts presidency?	New Mexico	Nevada	Arizona	Oklahoma	Oklahoma
People	Eleanor Roosevelt wrote a bi-monthly newspaper column called New in Washington.	True	False			False
People	Who is the author of the self-help book How to Win Friends and Influence People?	George Bush	John Maxwell	Dale Carnegie	Norman Vincent Peale	Dale Carnegie
People	Who created the fictional character Big Brother?	Robert Louis Stevenson	Joseph Heller	William Golding	George Orwell	George Orwell
People	This author, often referred to as The Father of Science Fiction, wrote the novel The War of the Worlds.	Douglas Adams	George Orwell	Herbert George Wells	J.R.R. Tolkien	Herbert George Wells
People	Freddie Prinze died in 1977 of a drug overdose.	False	True			False
People	Singer Aaliyah was killed in a car crash in 2001.	False	True			False
People	Which of the following people did NOT die from either an intentional or accidental gun shot wound?	Brandon Lee	Mike Jones	Jon-Erik Hexum	Jonathan Brandis	Jonathan Brandis
People	This eponym comes from the name of a humorous character from the writings of Teddy Roosevelts VP, Charles W.G. Fairbanks.	dweeb	booby	dummy	blurb	blurb
People	This eponym comes from the name of a mentally slow character  from a cartoon by E.C. Segar, the man who drew Popeye.	dweeb	mobster	idiot	goon	goon
People	We know that a scrooge is a miserly, unhappy person. From which Dickens novel do we get this word?	A Tale of Two Cities	A Christmas Carol	Nickolas Nickalby	The Pickwick Papers	A Christmas Carol
People	An atlas is a collection of maps. Where do we get the word atlas from?	A Roman god	The name of a Greek god	A famous Greek map maker	A famous Roman map maker	The name of a Greek god
People	He was a Greek who talked incessantly. This got on Zeus nerves so the talkative one was imprisoned  under a fruit tree. Whenever he tried to get one of the fruits, the fruit moved away from him. What was his name?	Pyhrrus	Dazzalus	Cicero	Tantalus	Tantalus
People	We get the word bikini from the name of a tiny atoll in the Pacific.	True	False			True
People	The Ritz cracker gets its name from Cesar  Ritz, a famous German hotel owner.	False	True			False
People	We get this term for a type of clothing from the royal name of  J.T. Brudnell, a famous British cavalry officer .	cardigan	derby	ragland	tuxedo	cardigan
People	This type of fruit gets its name from the name of an Australian fruit breeder.	Nectarine	Sweet Susan plum	Granny Smith apple	Bosc pear	Granny Smith apple
People	Which president used to go skinny dipping on warm nights?	Teddy Roosevelt	Abraham Lincoln	John Quincy Adams	William Howard Taft	John Quincy Adams
People	This U.S. president gave the longest inauguration speech ever to that date.	William Jefferson Clinton	Rutherford B. Hayes	William Henry Harrison	John F. Kennedy	William Henry Harrison
People	Which U.S. president fathered 15 children: 8 with his first wife and 7 with his second wife?	Lyndon B. Johnson	Zachary Taylor	William Taft	John Tyler	John Tyler
People	This U.S. president survived gall bladder surgery when he was 17 years of age.	George Washington	Dwight Eisenhower	Abraham Lincoln	James K. Polk	James K. Polk
People	Which president was engaged once but never married, making him the first U.S. president never to have been married when elected President of the United States?	James K. Polk	James F. Cooper	Franklin Pierce	James Buchanan	James Buchanan
People	Abraham Lincoln carried bills, his mail, and personal notes in his hat.	False	True			True
People	Which of these presidents only wore suits that he custom tailored himself?	Thomas Jefferson	James Garfield	Andrew Johnson	Rutherford B. Hayes	Andrew Johnson
People	Which of these U.S. presidents died of throat cancer?	Ulysses S. Grant	Rutherford B. Hayes	Abraham Lincoln	Franklin D. Roosevelt	Ulysses S. Grant
People	It is said that this president was a genius, who could write in Greek with his left hand and in Latin with his right at the same time.	Woodrow Wilson	James Garfield	Rutherford B. Hayes	Calvin Coolidge	James Garfield
People	Which U.S. president had his jaw removed?	Ronald Reagan	William McKinley	James Garfield	Grover Cleveland	Grover Cleveland
People	This president battled chronic stomach pain throughout his life, worsening during the time of his presidency.	Franklin Roosevelt	Harry S. Truman	Calvin Coolidge	Woodrow Wilson	Calvin Coolidge
People	Which U.S. president published more than 16 books during his life?	Franklin D. Roosevelt	Dwight D. Eisenhower	Herbert Hoover	James E. Carter	Herbert Hoover
People	This U.S. president married his girlfriend just 3 months after meeting her.	John Adams	George W. Bush	Theodore Roosevelt	William J. Clinton	George W. Bush
People	Which U.S. president was related to 11 former presidents by blood or marriage?	John Adams	LBJ	JFK	FDR	FDR
People	President Calvin Coolidge had a special bathtub made just for him.	True	False			False
People	He was the first Roman Catholic US President and his father was a prominent businessman.	Lyndon Johnson	James Carter	Franklin D. Roosevelt	John Kennedy	John Kennedy
People	In his 1916 presidential campaign for reelection, his supporters said he kept us out of war, but in his second term he led the US into World War One. He was only the second Democrat elected to the Presidency since the American Civil War.	William Howard Taft	Woodrow Wilson	Warren G. Harding	Theodore Roosevelt	Woodrow Wilson
People	He was a peanut farmer from Plains Georgia, a governor of Georgia and a graduate of the US Naval Academy.	Gerald Ford	James Carter	George Bush	Lyndon Johnson	James Carter
People	He will be remembered for positive accomplishments in foreign affairs, especially for improving relations between the United States and China. But he will also be remembered for the scandal that forced him to be the first President to resign from office.	Richard Nixon	Harry Truman	George Bush	Ronald Regan	Richard Nixon
People	He had to make some tough decisions, such as whether or not to drop the atomic bomb on Japan. But he seldom shied away from decisions or defending his policies. He was reelected in one of the biggest political upsets in US presidential history.	Warren Harding	Lyndon Johnson	Harry Truman	Dwight Eisenhower	Harry Truman
People	He was the first Vice-President in the twentieth century to become President after the death of a President. Later he was reelected for a four-year term on his own and proved to be one of the most progressive Republican Presidents in the 20th century.	Theodore Roosevelt	Calvin Cooledge	Woodrow Wilson	William Howard Taft	Theodore Roosevelt
People	He first became famous in Hollywood. As President he sometimes got his speech lines a little confused, but he went a long way with his friend Gorbachev toward ending the Cold War.	George Bush	Ronald Reagan	William Clinton	Richard Nixon	Ronald Reagan
People	Who was the only 20th century US President who was not elected as President or Vice-President by the people of the United States?	Gerald Ford	Lyndon Johnson	William H. Taft	Richard Nixon	Gerald Ford
People	Who was the only US President in the 20th century who served as a US Army general before he became President?	Dwight Eisenhower	James Carter	Herbert Hoover	Theodore Roosevelt	Dwight Eisenhower
People	Which US President was elected to four presidential terms?	Woodrow Wilson	Ronald Reagan	Calvin Coolidge	Franklin Roosevelt	Franklin Roosevelt
People	Which of the following US Presidents was NOT the governor of a state before becoming President?	William Clinton	James Carter	Richard Nixon	Ronald Reagan	Richard Nixon
People	Which US President was largely responsible for forming the international coalition that drove Saddam Hussein out of Kuwait in the Gulf War in the early 1990s?	George Bush	William Clinton	James Carter	Richard Nixon	George Bush
People	This man was a famous inventor and an American founding father.	Millard Fillmore	George Washington	Benjamin Franklin	Thomas Jefferson	Benjamin Franklin
People	This man wrote pamphlets such as Common Sense and the Rights of Man.	Thomas Paine	Thomas Jefferson	Lincoln Stubbs	Austin Paul	Thomas Paine
People	This man was a Confederate general but his loyalties almost always lied with the United States. He distinguished himself in the Mexican-American War and in the American Civil War.	Robert E. Lee	Daniel Walsh	Thomas Stone Wall Jackson	Rutheford B. Hayes	Robert E. Lee
People	This man, who was a key figure in the Reagan administration, was involved in the Iran-Contra Affair.	Oliver North	John Threadgill	Chesty Puller	Douglas McArthur	Oliver North
