Category	Question	Choice-1	Choice-2	Choice-3	Choice-4	Answer
People	What other title did Queen Victoria of England have?	Princess of Crete	Princess of Norway	Empress of India	Baroness of Scotland	Empress of India
People	By what moniker was Queen Victoria known?	Mrs. Brown	Grandmother of Europe	Queen Mum	Vicky	Grandmother of Europe
People	Queen Victoria was the first monarch to live in Kensington Palace.	True	False			False
People	Queen Victoria died of typhoid fever.	True	False			False
People	Who succeeded Queen Victoria on the British throne?	King George V	Queen Elizabeth II	King Edward VII	King George IV	King Edward VII
People	Slavery was banned in all of the British empire under Queen Victoria.	False	True			True
People	Where is Queen Victoria buried?	Braemar Scotland	Westminster Abbey	Arlington National Cemetary	Frogmore, Windsor	Frogmore, Windsor
People	How many lives is Ronald Reagan credited for saving while a life guard?	29	45	108	77	77
People	Ronald Reagan held many jobs, one of which was in sports. What was this job?	professional football player	Olympic track runner	professional baseball player	sports caster	sports caster
People	Which of these was Ronald Reagans favorite candy?	Jelly Beans	Chocolate	lollipops	gum	Jelly Beans
People	During World War II Ronald Reagan made training videos for the US Army Air Corps.	True	False			True
People	Ronald Reagan was originally a member of the Democratic party.	False	True			True
People	In which middle eastern country did terrorists attack an American marine barracks during the Ronald Reagan administration?	Iraq	Iran	Israel	Lebanon	Lebanon
People	What was the name of the man who shot Ronald Reagan in 1981?	John Hinckley	Lee Harvy Oswald	Jame Earl Ray	John Wilkes Booth	John Hinckley
People	What US president had a daughter named Margaret who became a successful writer of fiction and non-fiction books?	John F. Kennedy	Flanklin D. Roosevelt	Harry S. Truman	Dwight D. Eisenhower	Harry S. Truman
People	A former schoolteacher, this actress gained fame for her portrayal of The Wicked Witch of the West in the 1939 film The Wizard of Oz.	Margaret Hamilton	Margaret Rutherford	Margaret OBrien	Margaret Wright	Margaret Hamilton
People	Which author is not correctly matched with the novel she wrote?	Margaret Drabble - The Millstone	Margaret Mitchel - Gone with the Wind	Margaret Moore - The Blind Assassin	Margaret Atwood - Lady Oracle	Margaret Moore - The Blind Assassin
People	Name the famous author whose granddaughter committed suicide one day before the anniversary of his own suicide.	John OBrien	Ernest Hemingway	Jack London	Edgar Alan Poe	Ernest Hemingway
People	What event occurred six days after Marguerite de Valois (Queen Margot) marriage to Henry de Bourbon, the King of Navarre?	The Thermidorian Reaction	Womens March on Versailles	The storming of the Bastille	Saint Bartholomews Day	Saint Bartholomews Day
People	What war was the UK involved in during Margaret Thatchers tenure as Prime Minister?	The War in Bosnia and Herzegovina	The Gulf War	The Falklands War	The Vietnam War	The Falklands War
People	This Academy Award-winning actress starred opposite Judy Garland in the 1944 romantic musical film Meet Me in St. Louis.	Margaret Hamilton	Margaret Truman	Margaret OBrien	Margaret Sullivan	Margaret OBrien
People	Margaret Rutherford won an Academy Award for Best Supporting Actress for this movie, starring Elizabeth Taylor and Richard Burton.	The V.I.P.s	Cleopatra	Whos Afraid of Virginia Wolf?	The Taming of the Shrew	The V.I.P.s
People	This American cultural anthropologist, who was a featured writer and speaker in the mass media throughout the 1960s and 1970s, was a proponent of broadened sexual mores.	Margaret Truman	Margaret Mead	Margaret Reed	Margaret Hill	Margaret Mead
People	The Master and Margarita, which many critics regard as one of the greatest novels of the 20th century, tells the story of a visit by the Devil to a fervently atheistic society. In what country is the novel set?	The Soviet Union	Israel	East Germany (The German Democratic Republic)	China	The Soviet Union
People	What was the real first name of the infamous pirate Blackbeard?	William	Patrick	Edward	Roger	Edward
People	Where did Blackbeards famous ship sink?	Bermuda	The coast of Florida	The Coast of the Carolinas	The Caribbean	The Coast of the Carolinas
People	How long was Blackbeards reign of terror?	3 years	2 years	5 years	Almost 10 years	2 years
People	Blackbeard is considered the most successful pirate of all time.	True	False			False
People	A wreck which was claimed to be Blackbeards ship was discovered near North Carolina in 1978.	False	True			False
People	In what year did Blackbeard die?	1718	1716	1725	1721	1718
People	What American city did Blackbeard successfully blockade in his most daring and famous act?	Chesapeake Bay	Fort Lauderdale	Charlston	Raleigh	Charlston
People	After Blackbeard died, he was beheaded and his head was suspended from the ship of his captor.	False	True			True
People	What uniform number did baseball player Johnny Bench wear while with the Reds?	14	5	15	10	5
People	Len Dawson, who played quarterback for the KC Chiefs, wore number 16.	True	False			True
People	Jerry Rice wore number 82 when he played for the San Francisco 49ers.	False	True			False
People	What was the uniform number of Carlton Fisk when he played for the Chicago White Sox?	8	72	7	27	72
People	Bobby Hull wore number 9 when he played for the NHL team the Chicago Blackhawks.	True	False			True
People	What number did football quarterback Brian Griese wear while playing for the Chicago Bears (2006-2007)?	12	11	10	14	14
People	What number did Billy White Shoes Johnson wear when he played for the Houston Oilers?	81	88	84	85	84
People	Which of these players did not wear number 32?	Magic Johnson	O.J. Simpson	Jim Brown	Nolan Ryan	Nolan Ryan
People	Mother Teresa was a citizen of the United States of America.	True	False			True
People	What subjects did Mother Teresa teach, from 1930 to 1948, at St. Marys High School in Calcutta.	Reading and Writing	Theology and Psychology	Maths and Science	Geography and Catechism	Geography and Catechism
People	In her Nobel Prize acceptance speech, Mother Teresa declared, Abortion is the worst evil, and the greatest enemy of peace. However, she did admit that in some situations abortion may be necessary, after she learned that more than 450,000 women in East Pakistan (now Bangladesh) had been systematically raped, in the aftermath of the Bangladesh Liberation War.	True	False			False
People	What leading author of the Victorian era stated, Friendship is the inexpressible comfort of feeling safe with a person, having neither to weigh thoughts nor measure words.?	Oscar Wilde	Charles Dickens	George Eliot	William Blake	George Eliot
People	This famous philosopher and teacher of Alexander the Great said, Happiness depends upon ourselves.	Plato	Confucius	Aristotle	Socrates	Aristotle
People	What prolific American author does this quote belong to: Once can never consent to creep when one feels an impulse to soar.?	Ernest Hemingway	H.G. Wells	Helen Keller	Annie Sullivan	Helen Keller
People	What famous cartoonist said, Just remember when you are over the hill, you begin to pick up speed.?	George Burns	Walt Disney	Charles Schulz	Matt Groening	Charles Schulz
People	What exponent of the Arts and Crafts movement stated, There is no failure except in not trying.?	Pablo Picasso	Winston Churchill	Carl Lewis	Elbert Hubbard	Elbert Hubbard
People	What spiritual leader of his country made the following statement, We must be the change we wish to see in the world.?	Indira Gandhi	Abraham Lincoln	Mohandas Gandhi	Dalai Lama	Mohandas Gandhi
People	What Oscar and Emmy Award winner said, All of our dreams can come true, if we have the courage to pursue them.?	Helen Hayes	Walt Disney	John Wayne	Katharine Hepburn	Walt Disney
People	Name the famous lady who made the following witty remark: An archaeologist is the best husband a woman can have. The older she gets, the more he is interested in her.	Agatha Christie	Katharine Hepburn	Emily Bronte	Oprah Winfrey	Agatha Christie
People	What Irish playwright and author said, I can resist everything except temptation.?	G. B. Shaw	Oscar Wilde	Roald Dahl	James Joyce	Oscar Wilde
People	What political leader and noted orator is quoted here: A politician needs the ability to foretell what is going to happen tomorrow, next week, next month, and next year. And to have the ability afterwards to explain why it didnt happen.?	Harry S. Truman	Margaret Thatcher	Winston Churchill	Nelson Mandela	Winston Churchill
People	Tommy Lee from the band Motley Crue was married to this actress before he met Pamela Anderson.	Heather Locklear	Carmen Electra	Erika Eleniak	Tara Reid	Heather Locklear
People	Why did President Thomas Jefferson prefer writing to public speaking, and gave only two public speeches during his Presidency?	He had a stage fright	He had a speech defect	He didnt like talking	He had a facial deformation	He had a speech defect
People	Who had previously owned the Bel Air mansion bought by Sir Tom Jones upon moving to the United States in 1974?	Kirk Douglas	Hugh Hefner	Dean Martin	Elvis Presley	Dean Martin
People	Which of these words was coined by Sir Thomas More, who is regarded as one of the most influential Renaissance humanist scholars?	Utopia	Superman	Alter ego	Psychoanalysis	Utopia
People	On what popular TV show did the notorious Tom Cruise couch incident take place?	The Ellen DeGeneres Show	Late Show with David Letterman	The Tyra Banks Show	The Oprah Winfrey Show	The Oprah Winfrey Show
People	From what novel by Englishman Thomas Hardy did the term cliffhanger originate in 1873?	Two on a Tower	A Pair of Blue Eyes	The Woodlanders	Under the Greenwood Tree	A Pair of Blue Eyes
People	Tom from the popular Tom  Jerry cartoon was known by what name in his debut short Puss Gets the Boot?	Oliver	Mr. Jingles	Jasper	Mr. Cat	Jasper
People	What well-known person was roommates with actor and director Tommy Lee Jones back in college?	Al Gore	Steven Spielberg	Danny DeVito	Bill Clinton	Al Gore
People	What is the name of Tom Hanks first-born child, a son who followed the steps of his parents and turned to acting?	Edward	Nicolas	Colin	Jerry	Colin
People	How does Tom Thumb die according to the popular traditional tale from English folklore?	He freezes in the snow	He is bitten by a spider	He drownes in the Kings cup of tea	He is swallowed by a fish	He is bitten by a spider
People	Who was the first woman to rule a nation in recorded history?	Queen Hatshepsut of Egypt	Queen Elizabeth I of England	Razia Sultana of India	Czarina Catherine the Great of Russia	Queen Hatshepsut of Egypt
People	Who was the first woman to climb to the top of Mount Everest?	Anna Czerwinska, Poland	Stacey Allison, USA	Cathy ODowd, South Africa	Junko Tabei, Japan	Junko Tabei, Japan
People	Who was the first woman to arrive at the Magnetic North Pole on her own?	Helen Thayer	Ann Bancroft	Janice Meek	Hannenlore Schmatz	Helen Thayer
People	This woman is known as the first programmer because of her work with Charles Babbages analytical engine.	Mary Somerville	Annabella Byron	Elizabeth Leigh	Ada Lovelace	Ada Lovelace
People	In 1960, Richard Nixon lost the election to John F. Kennedy. This former UN Ambassador was Nixons running mate.	James J. Wadsworth	Henry Cabot Lodge, Jr.	Nelson Rockefeller	Barry Goldwater	Henry Cabot Lodge, Jr.
People	In 1964, Barry Goldwater lost the election in a landslide to Lyndon Baines Johnson. Name Goldwaters running mate who was the father of a radio talk show host.	Bill Limbaugh	Bill Schultz	Bill Miller	Bill Imus	Bill Miller
People	In 1968, Hubert Humphrey lost to Richard Nixon in the presidential election. This former governor and senator from Maine was his running mate.	Eugene McCarthy	Edmund Muskie	George McGovern	Thomas Eagleton	Edmund Muskie
People	In 1968, third-part segregationist candidate George Wallace drew support from a large number of Southern Democratism and ended up with 46 electoral votes. His running mate was this Air Force General.	John Patterson	Happy Chandler	Curtis Lemay	Strom Thurmond	Curtis Lemay
People	In 1972, George McGovern lost in a landslide to Richard Nixon. His first nominee for VP, was on the ticket for about two weeks, before being withdrawn amid allegations that he had undergone psychiatric hospitalization. Who was this first nominee?	Birch Bayh	Edmund Muskie	Sargent Shriver	Thomas Eagleton	Thomas Eagleton
People	In August of 1972, George McGovern nominated a second person as his running mate, who was on the ticket through the election. This man is the father-in-law of a US state governor. Who was the running mate?	Edmund Muskie	Sargent Shriver	Thomas Eagleton	Birch Bayh	Sargent Shriver
People	When Gerald Ford ran for President in 1976, he replaced the incumbent vice president with this man. The ticket was unsuccessful, losing to Jimmy Carter in the election.	Bob Dole	Nelson Rockefeller	Ronald Reagan	Spiro Agnew	Bob Dole
People	In 1984, former veep Walter Mondale lost the presidential election in a landslide to Ronald Reagan. Who was Mondales running mate?	Gary Hart	Geraldine Ferraro	Lloyd Bentsen	Jerry Brown	Geraldine Ferraro
People	In 1988, this vice presidential candidate (who ultimately lost the election) made waves when he told another candidate in a debate, Senator, youre no Jack Kennedy.	Jesse Jackson	George H.W. Bush	Lloyd Bentsen	Dan Quayle	Lloyd Bentsen
People	In 1992, third-party candidate Ross Perot chose this admiral to be his running mate.	James Stockdale	Steve Forbes	John Silber	Pat Choate	James Stockdale
People	This former pro football player was the vice presidential candidate for the losing side in 1996.	Jack Kemp	Jim Kelly	Jim Brown	OJ Simpson	Jack Kemp
People	This man was Al Gores running mate in the 2000 elections.	Joe Lieberman	Bill Richardson	John Kerry	John Edwards	Joe Lieberman
People	Who became the first man to run the mile in less then four minutes?	Sydney Wooderson	Gunder Hagg	Roger Bannister	Arne Andersson	Roger Bannister
People	Who won the Nobel Peace Prize for the first time?	Frederic Passy of France	Both of them	Henry Dunant of Switzerland	Neither of them	Both of them
People	Who was the first man to climb to the top of Mount Everest?	Andrew Waugh	Sir Edmond Hillary	Radhanath Sikdar	George Everest	Sir Edmond Hillary
People	Who was the first man to walk in space?	Boris Yegorov	Sergi Korolev	Alexi Leonov	Konstantin Feoktisov	Alexi Leonov
People	Who was the first man to swim the English Channel unaided?	Christiann Bernard	Matthew Webb	J.B. Johnson	Maxwell Dunkin	Matthew Webb
People	Who was the first man to fly over the North Pole?	Will Steger	Roald Amundsen	Matthew Henson	Matthew Peary	Roald Amundsen
People	Hamurabi, who is known for one of the first written civil codes, called Hammurabis Code, ruled this ancient empire.	India	Persia	Egypt	Babylon	Babylon
People	Which king of Israel captured Jerusalem and made it the capital of his kingdom?	David	Solomon	Saul	Josiah	David
People	Which Emperor created Imperial China?	Qin Shi Huang	Dowager Cixi	Zhu Yuanzhang	Kublai Khan	Qin Shi Huang
People	Who is considered the first Roman Emperor?	Julius Caesar	Octavian Augustus	Tiberius	Caligula	Octavian Augustus
People	Who is the only monarch of England to be called the Great?	Elisabeth I	Henry VIII	Victoria	Alfred	Alfred
People	What was the title of Hisham ibn Abd al-Malik, the great ruler of the Umayyad dynasty?	Emir	Caliph	Sultan	Imam	Caliph
People	Henry the Navigator, who initiated European worldwide expansion, was king of this country.	Portugal	France	Spain	England	Portugal
People	Ashoka the Great ruled during the Indian Golden Age. When was it?	Just before British rule	XV century AD	IV century AD	III century BC	III century BC
People	Which ruler introduced the metric system in much of Europe?	Napoleon Bonaparte of France	Franz Joseph of Austria-Hungary	Wladyslaw II Jagiello of Poland and Lithuania	Elisabeth I of England	Napoleon Bonaparte of France
People	Which of these monarchs holds the distinction of ruling the biggest empire in terms of land area?	Kublai Khan of Mongolia	George V of Great Britain	Charles III of Spain	Alexander II of Russia	George V of Great Britain
People	Idi Amin was a member of this tribe.	Langi	Masai	Kakwa	Acholi	Kakwa
People	Idi Amin was president of this African nation.	Tanzania	Sudan	Uganda	Kenya	Uganda
People	After being overthrown Idi Amin first went to this country.	Lebanon	Saudi Arabia	Libya	Egypt	Libya
People	What nickname did Idi Amin adopt?	Papa Doc	Big Bad Baddie	Big Daddy	The Big Bad Boss	Big Daddy
People	What British colonial regiment did Idi Amin join in 1946?	Kings African Rifles	Royal Gurkha Regiment	The Lighthorsemen	The Hussars	Kings African Rifles
People	Idi Amin expressed admiration for this German leader.	Paul Von Hindenburg	Kaiser Wilhem the 2nd	Otto Von Bismarck	Adolf Hitler	Adolf Hitler
People	In January of 1971 Idi Amin came to power by overthrowing this president.	Jomo Kenyatta	Mobutu Sese Seko	Milton Obote	Kwame Nkrumah	Milton Obote
People	What actor portrayed Idi Amin in the movie The Last King of Scotland?	David Oyelowo	James Mc Avoy	Forest Whitaker	Denzel Washington	Forest Whitaker
People	This man served as an aide to Idi Amin.	Ian Smith	Robert Astles	Cecil Rhodes	James Randolph	Robert Astles
People	In 1972 Idi Amin expelled these people from his country.	The British	The Arabs	The Asians	The Libyans	The Asians
People	Idi Amin once challenged this African leader to a boxing match.	Kwame Nkrumah	Jomo Kenyatta	Robert Mugabe	Julius Nyerere	Julius Nyerere
People	In November 1978 Idi Amins troops invaded this nation launching a war.	Sudan	Tanzania	Zaire	Kenya	Tanzania
People	Idi Amin was the tennis champion of Uganda from 1954 to 1958.	True	False			False
People	Which two George W. Bush cabinet members served with President Gerald Ford?	Cheney and Butz	Kleppe and Rumsfeld	Rumsfeld and Mansfield	Rumsfeld and Cheney	Rumsfeld and Cheney
People	What college did Gerald Ford attend?	Illinois State University	Harvard	Yale	UCLA	Yale
People	Critics of Gerald Ford point out that he lost his bid for the presidency in 1976 for what reason?	The Vietnam War	The Nixon pardon	His wifes alcoholism	The economy	The Nixon pardon
People	There is a breast cancer clinic named after Gerald Fords wife.	True	False			False
People	Prior to becoming President, Gerald R. Ford served in U.S. Congress representing what state?	California	Utah	Michigan	Pennsylvania	Michigan
People	Which of these politicians was Gerald R. Fords stiffest challenge in the Republican race in 1976?	Barry Goldwater	Robert Dole	Jimmy Carter	Ronald Reagan	Ronald Reagan
People	Gerald R. Ford nearly ran on the Republican ticket as a vice president in what year?	1972	1968	1980	1954	1980
People	James Earl Carter defeated Gerald Ford in the 1976 Presidential election.	False	True			True
People	What city was the capital of the ancient kingdom of Macedon when Alexander the Great was born?	Sparta	Pharos	Troy	Pella	Pella
People	Alexander the Greats mother, Olympias, claimed that this deity was Alexanders father.	Zeus	Apollo	Heracles	Hephaestus	Zeus
People	What Persian king did Alexander the Great defeat at the Battle of Issus (333 BC) and at the Battle of Gaugamela (331 B)?	Cyrus	Xerxes	Darius	Deioces	Darius
People	What was Alexander the Greats legendary horse, Bucephalus, afraid of?	saddles	sunshine	his shadow	fire	his shadow
People	Gordium, the city where according to legend Alexander the Great undid the intricate Gordian Knot, was the capital of this ancient kingdom.	Sparta	Phrygia	Illyria	Mesopotamia	Phrygia
People	What Roman Emperor is said to have taken Alexander the Greats armor from his tomb in Alexandria, Egypt?	Augustus	Caligula	Julius Caesar	Nero	Caligula
People	Which of Alexander the Greats generals became ruler of Egypt after Alexanders death and took the title of pharaoh?	Hephaestion	Lysimachus	Cassander	Ptolemy	Ptolemy
People	Alexander the Greats friendship with this Macedonian nobleman and general was compared to that of Achilles and Patroclus.	Hephaestion	Ptolemy	Laomedon	Erigyius	Hephaestion
People	What statement is true about the Wars of the Diadochi following Alexander the Greats death?	The term refers to the Battle of the Hydaspes River and the Battle of Gaugamela in which Alexanders army was led by his generals.	The term refers to the conflicts between the Ptolemaic Kingdom and the Roman Empire.	The term refers to the conflicts among Alexanders successors.	The term refers to the wars between the Greek city-states and the Roman Empire.	The term refers to the conflicts among Alexanders successors.
People	What trio of actors starred as Alexander the Great, King Philip II of Macedon and Queen Olympias in Oliver Stones 2004 movie Alexander?	Brad Pitt, Christopher Plummer, Angelina Jolie	Colin Farrell, Peter OToole, Catherine Zeta Jones	Colin Farrell, Val Kilmer, Angelina Jolie	Colin Farrell, Anthony Hopkins, Angelina Jolie	Colin Farrell, Val Kilmer, Angelina Jolie
People	In what month was the 26th President of the United States Theodore Roosevelt born?	October	April	January	June	October
People	Theodore Roosevelt was very athletic and engaged in sports as a child.	True	False			False
People	The 26th President of the United States, Theodore Roosevelt was very interested in mathematics during his childhood.	True	False			False
People	What university/college did Theodore Roosevelt attend?	Stanford	Harvard	Notre Dame	Princeton	Harvard
People	What was Theodore Roosevelts position during the Spanish-American war?	A cavalry man	A rough rider	A rifle man	He did not participate in the Spanish-American.	A rough rider
People	After Theodore Roosevelt’s first wife died, he married a childhood sweetheart.	True	False			True
People	What was the name of Theodore Roosevelts second wife?	Susie	Samantha	Alice	Edith	Edith
People	Which of these is the correct period of Theodore Roosevelts presidency?	1901-1909	1905-1909	1910-1918	1896-1900	1901-1909
People	Theodore Roosevelt was the first president to have a car, be submerged in a submarine, and own a telephone.	True	False			True
People	After his first wife’s death, Theodore Roosevelt went through another personal tragedy – his favorite son committed suicide. Where did this happen?	Alaska	Texas	Hawaii	Maryland	Alaska
People	All of the following share the same birth date of June 21st, but were they all born in the 60-year period between 1925 and 1985?	Yes	No			No
People	This diverse trio of Geminis were born on May 24th. One is a prominent folk singer (1941), the other one is a soulful songstress dubbed The Empress of Soul (1944) and the third one is the daughter of a country/rock and roll music legend (1955).	Bob Dylan, Patti LaBelle, Roseanne Cash	Woody Guthrie, Patti LaBelle, Roseanne Cash	Muddy Waters, Aretha Franklin, Roseanne Cash	Bob Dylan, Mary J Blige, Carlene Cash	Bob Dylan, Patti LaBelle, Roseanne Cash
People	Prince, Tom Jones and Liam Neeson were all born on June 7th but in different years.	False	True			True
People	With which two figures from Greek/Roman mythology is Gemini associated?	Aphrodite and Zeus	Castor and Pollux	Hades and Athena	Poseidon and Hera	Castor and Pollux
People	Who was the 4th president of the USA?	John Adams	James Monroe	Andrew Jackson	James Madison	James Madison
People	Where was George Washington, Americas first president, born?	Kentucky	Virginia	New York	Mississippi	Virginia
People	Abraham Lincoln was shot by John Wilkes Booth.	False	True			True
People	When was John F. Kennedy assassinated?	1961	1964	none of the above	1963	1963
People	Richard Nixon was the 35th president of the United States.	False	True			False
People	Who was the 40th president of the USA?	Gerald Ford	Ronald Reagan	George w.Bush	Jimmy Carter	Ronald Reagan
People	Ronald Reagan worked as a radio sports announcer after graduating from college.	True	False			True
People	What was Richard Nixons middle name?	David	Milhous	Milton	Howard	Milhous
People	Herbert Hoover directed the American Relief Committee.	True	False			True
People	Franklin D. Roosevelt was a New York state senator, before he became president of the United States.	True	False			True
People	What was the nickname of Edward Teach, the notorious English pirate who was active in the Caribbean Sea and western Atlantic during the Golden Age of Piracy?	Blackbeard	Calico Jack	Black Bart	Barbarossa	Blackbeard
People	What English pirate captain employed in his crew the only two female pirates of the Golden Age of Piracy – Anne Bonny and Mary Read?	Black Bart	Henry Morgan	Calico Jack (Jack Rackham)	Bartholomew Sharp	Calico Jack (Jack Rackham)
People	What term is applied to pirate flags which often featured skeletons, daggers, cutlasses, skulls and crossbones?	Jolly Jack	Jolly Rider	Jolly Roger	Horrible Roger	Jolly Roger
People	Who wrote the adventure novel Treasure Island which tells the story of pirates and buried gold?	Jules Verne	Rafael Sabatini	Emilio Salgari	Robert Louis Stevenson	Robert Louis Stevenson
People	Hayreddin Pasha, a Turkish pirate, who dominated the Mediterranean for decades, was nicknamed Barbarossa. What is the meaning of his nickname?	red beard	black beard	red nose	red eye	red beard
People	This sea captain, privateer and politician of the Elizabethan era was second-in-command of the English fleet against the Spanish Armada in 1588. He was respected as a hero by the English, but Spaniards considered him a pirate.	Francis Drake	Edward Teach	Horatio Nelson	Henry Morgan	Francis Drake
People	The city of Port Royal, known for Gallows Point where many pirates were executed, is located on what Caribbean Island?	Hispaniola	Jamaica	Cuba	Bermuda	Jamaica
People	This Barbadian landowner, sometimes called the gentleman pirate, bought a sailing vessel and decided to turn to piracy because of marital problems.	Calico Jack	Henry Morgan	Stede Bonnet	Edward Teach	Stede Bonnet
