Category	Question	Choice-1	Choice-2	Choice-3	Choice-4	Answer
People	Why  was Menachem Begin released  from Siberia in 1941?	He was not released. He escaped and made his way to Turkey and then to Israel.	Stalin personally required his knowledge and abilities	Because of the the Sikorski-Mayski Agreement	His term was up	Because of the the Sikorski-Mayski Agreement
People	What Zionist group did Menachem Begin join in 1942?	Irgun	Jewish Legion	Haganah	Palmach	Irgun
People	What was the aim of Altalena Affair that took place in June, 1948?	to kill Menachem Begin	to stop military equipment from reaching Israel	All of these	to sink the Altalena	All of these
People	The right-wing Israeli political party Likud was formed in what year?	1955	1975	1985	1965	1965
People	When did Menachem Begin become the first Likud Prime Minister of Israel?	1976	1977	1975	1974	1977
People	The Camp David Accords were signed by Egyptian President Anwar Sadat and Israeli Prime Minister Menachem Begin in what year?	1981	1979	1978	1980	1978
People	The Israeli air strike against the Iraqi Osirak nuclear reactor, ordered by Menachem Begin, is known under what name?	Operation Theatre	Operation Violin	Operation Opera	None of these	Operation Opera
People	When did Prime Minister Menachem Begin  retire from public office?	1992	1987	1983	1997	1983
People	Where was George Washington inaugurated as first President of the United States?	Philadelphia	Washington, D.C.	Annapolis	New York City	New York City
People	Who was George Washingtons first Secretary of Defense?	Pickering	Knox	This cabinet position did not exist	Hamilton	This cabinet position did not exist
People	What was George Washingtons first residence as President?	Osgood House	The White House	Blair House	Morris House	Osgood House
People	How many states comprised the Union when George Washington became President?	16	11	13	15	11
People	What were the first three executive departments during George Washingtons tenure as President?	Defense, State, Education	Navy, Education, Treasury	Agriculture, Treasury, State	War, State, Treasury	War, State, Treasury
People	What was the population of the US in 1790?	10 million	20 million	1 million	4 million	4 million
People	She was born in 1981 in New York and is the daughter of a real estate magnate.	Paris Hilton	Nicky Hilton	Ivanka Trump	Anna Anisimova	Ivanka Trump
People	This socialite, model actress, singer, fashion designer said Dress cute wherever you go, life is too short to blend in.	Claudia Schiffer	Anna Nikole Smith	Paris Hilton	None of these	Paris Hilton
People	This American actress and comedian starred in the 1996 movie Father’s Day as Carrie Lawrence.	Mishel Pheifer	Julia Roberts	Julia Louis-Dreyfus	Meg Ryan	Julia Louis-Dreyfus
People	Which of these ladies has been called the Russian Paris Hilton?	Anna Anisimova	Ekaterina Maximova	Alexandra Kollontai	Anna Pavlova	Anna Anisimova
People	This lady is an equestrian professional. She was featured in the HBO documentary Born Rich.	Jillian Terceira	Georgina Bloomberg	None of these	Melissa Pereech	Georgina Bloomberg
People	Born on January 5, 1984, she is the great-granddaughter of media tycoon William Randolph Hearst.	None of these	Patty Hearst	Amanda Hearst	Anne Hearst	Amanda Hearst
People	Fashion model Lydia Hearst-Shaw is heiress to the media empire established by William Randolph Hearst.	True	False			True
People	This socialite and fashion designer married businessman Todd Andrew Meister in 2004.	Dylan Lauren	Paris Hilton	Nicky Hilton	Aerin Lauder	Nicky Hilton
People	Her parents are co-founders of a pioneering cosmetics company.	Aerin Lauder	Dylan Lauren	Estee Lauder	None of these	Aerin Lauder
People	Her fathers is a clothing designer and one of her brothers is a filmmaker.	Donna Karan	Donatela Versache	Dylan Lauren	Diane von Furstenberg	Dylan Lauren
People	This national scientists of the Philippines is the inventor of the videophone.	Gregorio Zara	Nina Chua	Carmen Velasquez	Jose N. Rodriguez	Gregorio Zara
People	This person is the inventor of the Lunar Rover, more popularly known as the Moon Buggy.	Eduardo San Juan	Dr. Abelardo Aguilar	Edward Caro	Agapito Flores	Eduardo San Juan
People	Filipino inventor Fe del Mundo announced that he had invented a car that runs with water as fuel.	True	False			False
People	A Filipino scientist was reportedly the one who discovered the erythromycin in 1949.	False	True			True
People	Who was the Filipino that introduced the first single-chip graphical user interface accelerator and participated in developing the Ethernet controller chip that made the Internet possible?	Edgardo Vazquez	Gregorio Zara	Diosdado Banatao	Rudy Lantano Sr	Diosdado Banatao
People	This liquid allegedly developed by Filipino Department of Science and Technology is an iodine-rich drinking water that treats micronutrient deficiencies responsible for goiter, mental and physical retardation, and birth defects.	Goiter Program	EPI	Tubig Talino	Talino Life Program	Tubig Talino
People	The name of what Filipino popular means of public transportation evolved from a military designation of a light vehicle first used by the Americans in World War II?	Buggy	SUV	Jeepney	GI vehicles	Jeepney
People	What Welsh pirate was known for his love of fine clothing and jewelry?	Edward Teach	Francis Drake	Bartholomew Roberts	Henry Morgan	Bartholomew Roberts
People	What French pirate was given the title Baron by Napoleon Bonaparte?	Edward Teach	Mishel D’Gramon	Jan David No	Robert Surcouf	Robert Surcouf
People	According to rumors this Scottish sailor left behind a great treasure.	Henry Morgan	Francis Drake	William Kidd	Edward Teach	William Kidd
People	What notorious English pirate was reported to have lit matches woven into his black beard to intimidate his enemies during battle?	Bartholomew Roberts	John Rackham	John Cabot	Edward Teach	Edward Teach
People	This famous English pirate and politician of the Elizabethan era sailed around the world, returning to England in 1580.	Amerigo Vespucci	Bartholomew Roberts	Francis Drake	Marco Polo	Francis Drake
People	This Welsh privateer was knighted in 1674 and the following year he took up the post of Lieutenant Governor of Jamaica.	Henry Morgan	John Cabot	William Kid	Robert Morgan	Henry Morgan
People	Why were popular female pirates Аnne Bonny and Mary Read not executed after they were captured?	because they escaped from prison	because they were pregnant	because they were women	because they were found innocent	because they were pregnant
People	What famous pirate was arrested and conducted to the Kingdom of England in 1672 because he violated a peace treaty between England and Spain?	Francis Drake	Henry Morgan	John Cabot	Eduard Morgan	Henry Morgan
People	Ching Shih was a prominent Chinese female pirate active during what century?	20th	19th	18th	17th	19th
People	What legendary French corsair was nicknamed King of Corsairs due to his gallantry and chivalry?	Jacques Tavernier	Michel de Grammont	Robert Surcouf	Emanuel Wynn	Robert Surcouf
People	The Bermuda Triangle is located in the western part of the North Atlantic Ocean.	False	True			True
People	In what year did Flight 19, a training flight of TBM Avenger bombers, go missing while over the Atlantic?	1945	1955	1918	1977	1945
People	The loss of this US vessel with all 306 crew and passengers in 1918 was credited to the Bermuda Triangle.	Douglas DC-3	USS Cyclops	Mary Celeste	G-AHNP Star Tiger	USS Cyclops
People	In the 1970s, American author and pilot Larry Kusche made the following conclusion regarding the Bermuda Triangle.	Most of the incidents had been caused by storms or accidents.	Some of the incidents credited to the Triangle actually happened far from the Triangle.	The Triangle was a manufactured mystery.	All of these	All of these
People	Edgar Cayce, who was believed to be psychic, suggested that the Bermuda Triangle was the location of which of the following?	an alien base	Atlantis	a Nazi navy base	a US Navy base	Atlantis
People	The Bermuda Triangle area is among the most heavily-sailed shipping lanes in the world.	False	True			True
People	The disappearance of Theodosia Burr Alston, daughter of former US Vice President Aaron Burr, has been cited in relation to the Bermuda Triangle. She was a passenger aboard what ship when she disappeared?	The Patriot	Douglas DC-3	USS Cyclop	Flight 19	The Patriot
People	What Steven Spielberg film suggests that Flight 19 was abducted by aliens?	Indiana Jones	Jurassic Park	Star Wars	Close Encounters of the Third Kind	Close Encounters of the Third Kind
People	It was proven in the 1980s that some of the Bermuda Triangle incidents were related to compass problems.	False	True			False
People	What aircraft disappeared in 1948 while on a flight from San Juan, Puerto Rico, to Miami?	USS Cyclops	Raifuku Maru	Douglas DC-3	Sulphur Queen	Douglas DC-3
People	Senator Ted Kennedys Irish inherent eloquence made him a powerful orator, none more so than when he delivered these words need not be idealized, or enlarged in death beyond what he was in life; to be remembered simply as a good and decent man, who saw wrong and tried to right it, saw suffering and tried to heal it, saw war and tried to stop it. Who was eulogized in Senator Kennedys speech?	Martin Luther King, Jr.	Robert F. Kennedy	John F Kennedy, Jr.	John F. Kennedy	Robert F. Kennedy
People	Senator Ted Kennedy made a sudden, dramatic appearance in the summer of 2008 to cast the decisive vote for a cause he had fought for during his senate career. For what cause did Senator Kennedy come to vote Aye?	No Child Left Behind	Medicare	Age discrimination	Immigration	Medicare
People	Ted Kennedy was approached by the Green Bay Packers to play professional football.	False	True			True
People	From the floor of the Senate, Ted Kennedy described this mans America as one in which women would be forced into back-alley abortions, blacks would sit at segregated lunch counters, rouge police could break down citizens doors in midnight raids......the doors of the Federal courts would be shut on the fingers of millions of citizens. Who was the nominee to the U. S. Supreme Court that was the subject of Kennedys speech?	Harriet Miers	Clarence Thomas	Robert Bork	Abe Fortas	Robert Bork
People	Ted Kennedys hopes for becoming President of the United States were dealt a crushing blow on the night of July 18, 1969 in the swirling waters off Dike Bridge. Who was the young girl who died that night in an accident that is known as the Chappaquiddick incident?	Easter Newberg	Cricket Keough	Mary Jo Kopechne	Mary Ellen Lyons	Mary Jo Kopechne
People	For me, a few hours ago, this campaign came to an end. For all those whose care have been our concern, the work goes on, the cause endures, the hope still lives and the dream shall never die. These are words from Ted Kennedys concession speech after his failed run for the 1980 Democratic nomination for President of the United States. Who defeated Kennedy in his only bid for the Presidency?	Jimmy Carter	Robert Dole	Michael Dukakis	Walter Mondale	Jimmy Carter
People	In April 2009, Senator Ted Kennedy was asked to throw out the ceremonial first pitch on opening day for this major league team. In what stadium would you be sitting to watch Senator Kennedys first pitch?	Candlestick Park	Fenway Park	Wrigley Field	Yankee Stadium	Fenway Park
People	Although Ted Kennedy enjoyed great success in the Senate, his behavior in his personal life	Joseph Patrick Kennedy	William Kennedy Smith	Michael Skakel	David Kennedy	William Kennedy Smith
People	Who was Ted Kennedy speaking of with these lines, He had every gift but length of years.	John F. Kennedy, Jr	Martin Luther King	David Kennedy	Robert Kennedy	John F. Kennedy, Jr
People	Who delivered the eulogy at Senator Ted Kennedy funeral?	Joseph Patrick Kennedy	President Obama	Caroline Kennedy	Christopher Dodd	President Obama
People	What is the meaning of the Hebrew name Michael?	Who loves like God?	Who creates like Gog?	Who is like God?	Who saves like God?	Who is like God?
People	What is the meaning of the Hebrew name Elizabeth, Elisabeth or Elisheva?	My God is a blessing.	My God is love.	My God is light.	My God is an oath.	My God is an oath.
People	What does the Hebrew name Isaac mean?	Honey	River	Summer	Laughter	Laughter
People	What is the meaning of the Hebrew name Sarah?	Flower	Delicate	Princess	Wind	Princess
People	What does the biblical name Benjamin mean in Hebrew?	Man of many blessings	He who carries the light with him	Son of my right hand	He who is blessed and well	Son of my right hand
People	Which of these titles were Prince William and Kate Middleton granted upon marriage by Elizabeth II?	Duke and Duchess of York	Prince and Princess of Buckingham	Duke and Duchess of Cambridge	Prince and Princess of Wales	Duke and Duchess of Cambridge
People	What is Kate Middleton prohibited to do after becoming a member of the British royal family on April 29, 2011?	sign unoffcial documents	play Monopoli	all of these	run for public office	all of these
People	What US building was lit in red, white, and blue at sunset on 29 April 2011, to mark the wedding of Prince William and Kate Middleton?	Empire State Building	Sears Tower	The Chrysler Building	US Capitol Building	Empire State Building
People	Prince William proposed to Kate Middleton in October 2010 while on a private holiday in this country.	Nigeria	the Republic of Seychelles	Kenya	Australia	Kenya
People	Prince William and Kate Middleton share common ancestors.	False	True			True
People	Name the venue, known as Royal Peculiar, where Prince William and Cathrine Middleton got married.	Buckingham Palace	Windsor Castle	St. Pauls Cathedral	Westminster Abbey	Westminster Abbey
People	Who read an extract from the New Testaments Epistle to the Romans during Prince William and Kate Middletons wedding ceremony?	Kate Middletons sister, Pippa	Kate Middletons brother, James	Prince Williams brother, Harry	Kate Middletons father, Michael	Kate Middletons brother, James
People	At the time of her wedding Cathrine Middleton, who has been dubbed Waity Katie, became the oldest royal bride in history. How old was she when she walked down the aisle?	28	31	29	30	30
People	Which of these celebrities was NOT invited to Prince William and Cathrine Middletons wedding?	Elton John	David Beckham	Rowan Atkinson	Ewan McGregor	Ewan McGregor
People	What English designer created Kate Middletons bridal gown, which was made of satin and featured a hand-made lace bodice?	Elizabeth Emanuel	Victoria Beckham	Stella McCartney	Sarah Burton	Sarah Burton
People	Senator Edmund Muskie of Maine ran on the ticket with sitting Vice President Hubert Humphrey in 1968.	True	False			True
People	Which senator represented California from 1969-1993?	Albert Gore Sr.	Alan Cranston	Victor Ramos	Terrance Day	Alan Cranston
People	After serving 5 US Presidents, Senator Elizabeth Dole won election to the Senate from North Carolina in 2002.	True	False			False
People	This senator served Ohio in the US Senate from 1976 to 1995 as a Democrat.	Paul Simon	Howard Metzenbaum	Robert Taft Jr.	Paul ONeill	Howard Metzenbaum
People	John L. McClellan served as Arkansas senator from 1942-1977.	False	True			True
People	Which low-keyed US senator served Maryland from 1977 to 2006?	Paul Simon	Paul Sarbanes	Paul Laxalt	Paulie Shore	Paul Sarbanes
People	Morris K. Udall, from Arizona served in the US Senate until 1991 and wrote an autobiography entitled Too Funny to Be President.	False	True			False
People	In 1981, Senator Charles Grassley started representing Iowa as a Democrat.	False	True			False
People	In what state was Franklin D. Roosevelt (FDR) born and from what college did he get his undergraduate degree?	New York; Harvard	New York; Princeton	New Jersey; Columbia	Massachusetts; Harvard	New York; Harvard
People	What was the last public office that FDR held before being elected president?	governor of Massachusetts	vice-president of the United States	governor of New York	senator from Massachusetts	governor of New York
People	Who did FDR defeat to win the presidential election in 1932?	Herbert Hoover	Calvin Cooledge	Woodrow Wilson	None of these	Herbert Hoover
People	FDR was confined to a wheelchair throughout his presidency due to which of the following?	muscular dystrophy	a failed assassination attempt while he was a candidate for the presidency	polio	an automobile accident	polio
People	The New Deal was a series of economic programs passed during the first term of FDR. Part of the New Deal were the PWA (Public Works Administration) and the WPA (Works Progress Administration) which were intended to do which of the following?	all of these	inject money into the economy	build useful public projects such as roads, schools, etc.	provide jobs for the unemployed	all of these
People	Which of the following programs, started as part of the New Deal, did NOT last into the 21st century?	Tennessee Valley Authority	Social Security	Securities and Exchange Commission	National Recovery Board	National Recovery Board
People	Roosevelt was very effective in communicating with the American people by radio. What did he call his best known radio broadcasts to the American people?	The US Today	The Presidents Report	The FDR Hour	Fireside Chats	Fireside Chats
People	Which of the following were most likely to dislike and oppose Franklin D. Roosevelt?	working class people	Afro-Americans	people living in large cities	wealthy people	wealthy people
People	FDR favored helping Britain in its fight with Germany after 1939. However, he was limited in ability to send military equipment to Britain because of strong opposition. Which of the following most strongly influenced FDR to go slow on aid to Britain?	socialists	isolationists	anti-war groups	the German-American Bund	isolationists
People	After the Japanese attack on Pearl Harbor, Franklin D. Roosevelt went before Congress to call for a declaration of war on Japan. What was his memorable phrase for the day of the attack?	a turning point of history	None of these	day of the Jap sneak attack	date that will live in infamy	date that will live in infamy
People	This person helped Franklin D. Roosevelt by mixing with the US people and relaying their ideas and feelings to the president.	his vice president John Garner	his son Elliot Roosevelt	his wife Eleanor Roosevelt	his secretary of state Cordell Hull	his wife Eleanor Roosevelt
People	Which statement is true about FDR?	He was the first US President to die of natural causes while in office.	He was the first US President to be elected for four presidential terms.	all of these	He was the first US President to act as commander-in-chief of the armed forces during wartime.	He was the first US President to be elected for four presidential terms.
People	Where did George Washington and his troops enter winter quarters after Trenton and Princeton in early 1777?	Morristown	Brandywine	Cambridge	Valley Forge	Morristown
People	During the Revolutionary War, George Washington sent armed schooners to prey on enemy shipping for supplies.	False	True			True
People	Throughout the American War for Independence, Martha Washington traveled with her husband George Washington a majority of the time and was close by.	False	True			True
People	What happened to John McCain III while serving in Vietnam?	He became a prisoner of war.	He won the Medal of Honor.	His tank was blown up.	He almost died of Malaria.	He became a prisoner of war.
People	What branch of service did John McCain III serve in?	Air Force	Army	Navy	Marines	Navy
People	John McCain III cant comb his hair.	True	False			True
People	What college did John McCain III attend?	United States Military Academy	Yale	United States Naval Academy	Harvard	United States Naval Academy
People	What year was John McCain III born?	1938	1935	1936	1934	1936
People	In 1987, John McCain III assumed office as a Senator from this state.	Arizona	New Mexico	Florida	Georgia	Arizona
People	Which Southeastern state primary was crucial in the 2000 election battle between George W. Bush and John McCain?	Alabama	South Carolina	North Carolina	Georgia	South Carolina
People	In 2008, this newspaper reported on John McCains relationship with a lobbyist in Washington?	Time Magazine	Washington Post	Atlanta Journal Constitution	New York Times	New York Times
People	What aircraft did John McCain III fly while in the military?	A-10 Thunderbolt	F-15 Eagle	F-104 Starfighter	A-4 Skyhawk	A-4 Skyhawk
People	How many medals did John McCain III receive while in the military?	8	5	6	1	5
People	Which statement is true?	At age 37 Tom Monaghan founds the Dominos Pizza chain.	At age 37 Franz Kafka publishes The Metamorphosis.	At age 37 King James commissions a translation of the Bible.	At age 37 Emperor Nero fiddles while Rome burns.	At age 37 King James commissions a translation of the Bible.
People	Who portrayed Jesse James in the 2007 movie The Assassination of Jesse James by the Coward Bob Ford?	Keifer Sutherland	Brad Pitt	John Travolta	Charlie Sheen	Brad Pitt
People	Who played Jesse James in the 1966 horror fantasy movie Jesse James Meets Frankensteins Daughter?	John Lipton	John Lupton	Elton John	John Wayne	John Lupton
People	Who played Jesse James in the1939 film Jesse James at Bay?	Roy Rogers	Jimmy Stewart	John Wayne	Audie Murphy	Roy Rogers
People	Did Robert Wagner play Jesse in the 1957 movie The True Story of Jesse James?	Yes	No			Yes
People	In 624, this priestess led the Arabian Quraish against Muhammad.	Nusaybah bint Ka’ab	Aisyah	Hind - Al - Hunnud	Khadijah	Hind - Al - Hunnud
People	In 1945, Fidel Castro entered the University of Havana to study what major subject?	Medicine	Agriculture	Arts	Law	Law
People	When Fidel Castro was a teenager, he chose the middle name Alejandro referring to which historical figure?	Alexander Pope	Alexander the Great	Alejandro Escovedo	Alexander Graham Bell	Alexander the Great
People	Cuban political leader Fidel Castro has three sisters. Two of them are named Juanita and Emma. What is the name of the third one?	Salma	Kim	Angela	Jessica	Angela
People	What revolutionary organization did Fidel Castro lead in order to overthrow the regime of Fulgencio Batista in Cuba in 1959?	The American Popular Revolutionary Alliance	The 26th of July Movement	The Cuban Army	The Communist Party of Cuba	The 26th of July Movement
People	What is Fidel Castros astrological sign?	Scorpio	Gemini	Leo	Aquarius	Leo
People	Where did Cuban political leader Fidel Castro meet  Ernesto Che Guevara for the first time?	Argentina	Cuba	Mexico	Bolivia	Mexico
People	In July 2006, Fidel Castro transferred his duties to his brother Raúl, Vice President of the Cuban Council of State for what reason?	Fidel Castro retired from the position of President of the Republic of Cuba.	To recover from surgery.	His brother overthrew his government.	He changed his political views.	To recover from surgery.
People	What is the name of Fidel Castros second wife, mother of five of his sons?	Naty Revuelta	Mirta Díaz-Balart	Alina Fernández-Revuelta	Dalia Soto del Valle	Dalia Soto del Valle
People	What rank does Cuban leader Fidel Castro hold in the Cuban military?	Primer Teniente	General de Brigada	Comandante en Jefe	General de Ejército	Comandante en Jefe
People	This prominent American director, famous for the movies Alexander, Nixon and JFK, also directed the film Comandante in 2003 in which he interviewed Fidel Castro.	Steven Spielberg	Barry Sonnenfeld	Oliver Stone	Steven Soderbergh	Oliver Stone
People	What does the name Joseph or Yosef mean according to the Bible?	May Yahweh add to his years	May Yahweh add another son for me	May Yahweh bless his home	May Yahweh illuminate his way through the darkness	May Yahweh add another son for me
People	What is the meaning of the name Solomon?	Wisdom	Brave	King	Peace	Peace
People	The biblical name Delilah originated from a Hebrew word with this meaning.	Weak, poor	Hypocritical, deceptive	Bad, evil	Seductive, tempting	Weak, poor
People	What is the meaning of the names Judah, Jude and Judas?	Lean	Praised	Fallen	Treacherous	Praised
People	What is the meaning of the biblical name Noah?	He who creates with his hands	Consolation	The one who saves us	Resilience	Consolation
People	What does the biblical name Rebekah or Rebecca mean?	Captivating	Kind-hearted	Wife	Obedient	Captivating
People	What does the Hebrew name Gabriel mean?	May God be with us	God is above all	God is the way	God is my strength	God is my strength
People	Who invented the the first friction match?	Joseph Woodlock	Peter Smith	John Walker	Steven Brown	John Walker
People	The earliest production of soap is believed to date back to this period.	4th century BC	7th millennium BC	3rd millennium BC	1st century AD	3rd millennium BC
People	The first university or academy in the world was founded by this person in Ancient Greece.	Alexander of Macedonia	Plato	Aristotle	Socrates	Plato
People	In what part of the world were the first known soft drinks developed?	the Near East	Japan	Africa	All of these	the Near East
People	In what century was the earliest recorded reservoir pen created?	10th century	5th century	17th century	14th centry	10th century
People	In what country was the first reported working telescope created?	Egypt	China	The Netherlands	Greece	The Netherlands
People	The earliest recorded vaccination in history was carried out during the 17th century against this disease.	Rabies	Tuberculosis	Smallpox	Plague	Smallpox
People	Kim Jong il is a harsh critic of Hollywood and looks down upon the movie industry with contempt.	True	False			False
People	Kim Jong il wrote a book on this subject.	Chinese history	Opera	Chess	Sports cars	Opera
People	Who was Kim Jong-ils father?	Sun Hae Rok	Park Chung Hee	Syngman Rhee	Kim il Sung	Kim il Sung
People	According to Soviet records, Kim Jong-il  was born on February 16, 1941 near this city.	Pyongyang, North Korea	Khabarovsk, USSR	Seoul, South Korea	Beijing, China	Khabarovsk, USSR
People	Kim Jong il wrote a book on film making.	False	True			True
