Category	Question	Choice-1	Choice-2	Choice-3	Choice-4	Answer
People	What music video portrays Kylie Minogue lying amongst many men and women by a poolside?	On a Night Like This	Red Blooded Woman	Chocolate	Slow	Slow
People	Which statesman uttered these words: “Thus, by every device from the stick to the carrot, the emaciated Austrian donkey is made to pull the Nazi barrow up an ever-steepening hill”?	Winston Churchill	Joseph Stalin	Franklin D. Roosevelt	Charles DeGaulle	Winston Churchill
People	There is no glory in outstripping donkeys” was a statement by this Greek Emperor.	Romulus Augustus	Marcus Aurelius	Tiberius	Hadrian	Marcus Aurelius
People	Which modern day comedian annoyed his wife with this saying: “I kept giving her donkey ears.”?	Chevy Chase	Adam Sandler	Dan Aykroyd	Ben Stiller	Chevy Chase
People	This Welsh-born English poet said: If a donkey bray at you, dont bray at him”.	George Herbert	Waldo Williams	Bertrand Russell	Dylan Thomas	George Herbert
People	“I lived in the US for donkeys years so it has been a journey back in time for me. If you have had personal experience of something, it is always more authentic.” is a quote by this Australian author.	Isobelle Carmody	Kate Morton	Melina Marchetta	Colleen McCullough	Colleen McCullough
People	“In school nativity plays I was always the bloody little donkey, I was never Mary.” says this singer-songwriter who is also famous as a member of an all female group. Who is she?	Keren Woodward	Rozonda Chilli Thomas	Geri Halliwell	Kelly Rowland	Geri Halliwell
People	“That which is called firmness in a king is called obstinacy in a donkey” is a quote by an American author and educator.	John Erskine	Jerome Allen	Herbert Kohl	John Corcoran	John Erskine
People	“Do you think yourself wise? Then theres a donkey inside your waistcoat” is a quote from one of the British preacher/theologians of the 19th century.	Charles H. Spurgeon	Hugh Price Hughes	Borden Parker Bowne	William Burt Pope	Charles H. Spurgeon
People	“I do believe the Democratic party has moved far to the right. I do believe that the party has a bunch of elephants running around in donkey clothes.” is a quote by this outstanding American reverend.	Al Sharpton	Louis Farrakhan	Jesse Jackson	Jeremiah Wright	Al Sharpton
People	“Yeah, blindfolds, just like pin the tail on us. Were the donkey.” is a quote from an American lead vocalist and musician of a heavy metal band. Who is he?	Vince Neil	Robert Plant	Axl Rose	Rob Halford	Vince Neil
People	“Let him not recite the Veda on horseback, nor on a tree, nor on an elephant, nor in a boat ,or ship , nor on a donkey, nor on camel, nor standing on barren ground, nor riding in a carriage.” was spoken by one of the 11 gurus of India. Which one?	Guru Granth Sahib	Guru Nanak	Guru Angad	Guru Har Gobind	Guru Nanak
People	After the death of her lover, Cleopatra found true love.  Though Egypt and Rome did not get along,  these two people married in 36 B.C, planning to conquer Rome.	Antony and Cleopatra	Ptolemy and Cleopatra	Julius Caesar and Cleopatra	Octavian and Cleopatra	Antony and Cleopatra
People	When the ruler of the Mughal Empire married his favorite wife, they were still teenagers. She gave birth to 14 children. After her death  in 1629, the grieving emperor created one of worlds most beautiful edifices - Taj Mahal, paying tribute to his beloved wife.	Alfred Lunt and Lynn Fontanne	Shah Jahan and Raza Devi	Abelard and Heloise	Shah Jahan and Mumtaz Mahal	Shah Jahan and Mumtaz Mahal
People	In 1898, three years after their marriage,  this scientific couple  discovered polonium and radium. Thus,  they won the Physics Nobel Prize in 1903 for discovering radioactivity.	Anthony and Cleopatra	Abigail and John Adams	John Alden and Priscilla Mullins	Marie and Pierre Curie	Marie and Pierre Curie
People	The beautiful Egyptian queen was chief wife of an Egyptian Pharaoh in 14th century BC. The couple remained in history as great reformers due to the profound religious changes they made - they introduced the monotheistic worship of the sun disk.	Tutankamun and Cleopatra	Nefertiti and Ay	Amenhotep IV and Nefertiti	Tutankamun and Nefertiti	Amenhotep IV and Nefertiti
People	Philosophy brought together this ancient Greek couple.  The wife had a courtesan salon which was frequented by many of the philosophers we now know, but only one of them got to really know her. Noted for her great intellectual power, she gave him inspiration for his work in rhetorics.	Aspasia and Plutarch	Aspasia and Plato	Aspasia and Pericles	Aspasia and Xenophon	Aspasia and Pericles
People	She was a successful Hollywood actress and he was the president of the USA.  They never managed to be together legally, but their relationship was a public secret.	Marilyn Monroe and Joe DiMagio	Marilyn Monroe and John Kennedy	Ava Gardner and Bobby Kennedy	Ava Gardner and Frank Sinatra	Marilyn Monroe and John Kennedy
People	Being romantic poets, these two had a really romantic relationship. They knew how to do it, including all the elements a romantic story needs: secret courtship, love poems and everything necessary for their love to thrive.	Charles and Katherine Dickens	Robert and Elizabeth Browning	Marie and Pierre Curie	Sappho and Homer	Robert and Elizabeth Browning
People	He was a famous French conqueror,  but this wasnt enough for her to accept the marriage proposal immediately. She hesitated at first, but finally agreed.	Napoleon and Josephine Baker	Napoleon and Josephine	Alexander the Great and Cleopatra	Amenhotep and Nefertiti	Napoleon and Josephine
People	The most famous gangster couple in history, her last name was Parker and he was the anti-authoritarian criminal Barrow.	Bonnie and Clyde	Cuocolo and Cutinelli	Barre and Lebiez	Lou Jean Poplin and Clovis	Bonnie and Clyde
People	On April 9, 2005 their marriage ended years of speculation on a relationship which has spanned the decades since they first met in 1970.	Charles and Camilla	Kate Beckingsale and Len Wisemen	Catherine Zeta-Jones and Michael Douglas	Jason Priestley and Naomi Lowde	Charles and Camilla
People	Babe Ruths nickname	The Crusher from Conrad	The Yankee menace	The Sultan of Swat	The Prince of Power	The Sultan of Swat
People	Red Grange	The Galloping Ghost	The Illini Rocket	Greased Lightning	The Wheatfield Warrior	The Galloping Ghost
People	Jerry West	Mr. Gearhead	Mr. Amazing	Mr. Fantastic	Mr. Clutch	Mr. Clutch
People	Edson Arantes Do Nascimento	Maradonna	Carmingo	Barloli Dominguez	Pele	Pele
People	Jack Nicklaus	The Golden Eagle	The Golden Buckeye	The Golden Swing	The Golden Bear	The Golden Bear
People	Rod Laver	Booster	Rocket	Ram	The Australian Lion	Rocket
People	Joe Namath	White Shoes	5th Avenue Joe	Broadway Joe	Smooth as Silk	Broadway Joe
People	Willie Mays	The Kansas Kid	Fearless	The Say-Hey Kid	The Frisco Phenom	The Say-Hey Kid
People	Bobby Hull	The Golden Blackhawk	The Golden Flash	The Golden Goose	The Golden Jet	The Golden Jet
People	Paavo Nurmi	The Finnish Flash	The Turko Wonder	The Flying Finn	The Turko Turbo	The Flying Finn
People	Gary Leon Rigway is known as the Green River Killer, responsible for at least 48 murders.  What kind of people did he target?	Nurses	Prostitutes and runaways	Schoolboys	Schoolgirls	Prostitutes and runaways
People	This serial killer, known as The Ripper of Rostov, roamed Russia in the late 1900s.  He was later found guilty of 52 murders and sentenced to death.	Anatoly Onoprieno	Vadim Yershov	Nikolai Dzhurmongaliev	Andrei Chikatilo	Andrei Chikatilo
People	The Monster of the Andes, as Pedro Lopez is known, terrorized Ecuador, Peru and Colombia. How many people did he victimize?	More than 300	More than 100	More than 50	More than 200	More than 300
People	Certainly one of the most dreadful serial killers in US history. Even though he performed as a clown at neghborhood childrens parties, he killed 33 teenagers.	Joe Ball	John Wayne Gacy	Marie Besnard	Albert Fish	John Wayne Gacy
People	Bruno Ludke was born in 1909. When he was young, he tortured animals for fun. He strangled or stabbed to death 85 women.  Where was he from?	Russia	Great Britain	America	Germany	Germany
People	This serial killer terrorized Washington, Oregon, Colorado, Utah, and Florida. His death sentence was executed in Florida on 24 January 1989.	Richard Ramirez	Richard Iceman Kuklinski	Juan Corona	Ted Bundy	Ted Bundy
People	This mans rampage lasted from 1979 to 1981. He roamed Atlanta and Georgia, taking the lives of 27 innocent boys. At first the police thought he was a white supremacist, because he targeted black boys, but it turned out he was black himself.  He was caught on 22 May 1981.	Kendall Francois	Wayne Williams	Guy Georges	Robert Berdella	Wayne Williams
People	This serial killer was known as The Candy Man. His partner,  Wayne Henley, eventually shot him.	Richard Angelo	Dean Corll	Clifford Robert Olson	Abdallah al-Hubal	Dean Corll
People	Henry Lee Lucas confessed to more than 500 murders. How many murders was he actually convicted of?	600	201	255	11	11
People	There are many theories about the identity of this mysterious British serial killer. He marks the dawn of the modern age of serial murders. Although the number of his victims is not high, compared to others on our list (5), he is probably the worlds most famous serial murderer.	Earl Frederick	Jack The Ripper	The Toledo Clubber	Joel Rifkin	Jack The Ripper
People	He disliked Jews and accused them of causing all disasters in German history.	Mussolini	Lenin	Stalin	Hitler	Hitler
People	He delivered the famous I have a dream speech.	Mao Zedong	Martin Luther King Jr.	Ho Chi Minh	Pope John Paul II	Martin Luther King Jr.
People	She was the only woman to become Prime Minister of Great Britain.	Diane Julie Abbott	Queen Victoria	Margaret Thatcher	Elizabeth Furse	Margaret Thatcher
People	He was the only Pope of non-Italian origin since the Dutch-German Pope Adrian VI.	John Paul I	Benedict XVI	Blessed John XXIII	Pope John Paul II	Pope John Paul II
People	He was the only actor to become US President.	Teddy Roosevelt	Franklin Delano Roosevelt	Ronald Reagan	Bill Clinton	Ronald Reagan
People	He was the first democratically-elected President of South Africa.	Nelson Mandela	Martin Luther King	Mao Zedong	Lech Walesa	Nelson Mandela
People	He brought the cause of Indias independence to world attention.	Ho Chi Minh	Lech Walesa	Nelson Mandela	Mohandas Gandhi	Mohandas Gandhi
People	Which British Prime Minister is considered to have saved his country during WW2?	Edward Heath	Neville Chamberlain	Edward Churchill	Winston Churchill	Winston Churchill
People	He established the first fascist party.	Hitler	Winston Churchill	Benito Mussolini	Stalin	Benito Mussolini
People	The name he is known as means Awakened One, Enlightened One.	Jesus Christ	Dalai Lama	Buddha	Mohamed	Buddha
People	Before becoming an important political figure, this George was a businessman, involved with the oil industry and then with professional sports.	George Washington	George W Bush	George Orwell	George Eliot	George W Bush
People	This George is one of the greatest English novelists. The term Big Brother comes from his book 1984.	George Eliot	George Sand	George Bernard Shaw	George Orwell	George Orwell
People	This George was the first president of the USA. Although the American capital city was named after him, he never lived there.	George Orwell	George Washington	George Lucas	George Bush	George Washington
People	This George was actually a woman and her real name was Mary Ann Evans. She used a male pen name because she wanted the publishers to take her works seriously.	George Sand	George Bernard Shaw	George Orwell	George Eliot	George Eliot
People	This George received the Nobel Prize in literature in 1925 but he didnt take the prize money. Instead, he gave the money for funding the translation of Swedish literature into English.	George Bernard Shaw	George Sand	George Fox	George Orwell	George Bernard Shaw
People	In 1997 this George was voted Sexiest Man Alive by People magazine. His first TV role was in the TV series E/R.	George Fox	George Clooney	George Lucas	George Herbert	George Clooney
People	This George lived for only 40 years - from 1593 until 1633. Nevertheless, he became a great poet. However, none of his works was published while he was alive.	George Gordon Byron	George Herbert	George Fox	George Eliot	George Herbert
People	His most famous works were Childe Harolds Pilgrimage and Don Juan. His fame rests not only on his romantic poems; he was known for his lifestyle, which included extravagant living, debts, separation, claims of incest, etc.	George Eliot	George Gordon Byron	George Lucas	George Sand	George Gordon Byron
People	This George was also a woman. Her real name was Amandine-Aurore-Lucile Dupin. She was a feminist before the invention of the word. She had a romantic relationship with Chopin.	George Herbert	George Sand	George Eliot	George Fox	George Sand
People	This George is the director of one of the most famous movie sagas. However the script for this saga was initially turned down by every major Hollywood studio because no one would want to see it.	George Orwell	George Clooney	George Michael	George Lucas	George Lucas
People	This John was a writer. He received the Nobel price for literature in 1962 for his �realistic and imaginative writing, combining as it does sympathetic humour and keen social perception.�	John Tolkien	John Steinbeck	John Wayne	John Milton	John Steinbeck
People	This famous English poet is the author of Paradise Lost. The long hours of writing under the light of a candle cost him his eyesight. He then started using a scribe.	John Tolkien	John Milton	John Denver	John Steinbeck	John Milton
People	This John was a member of one of the most popular bands from the 60s.  Earlier, he has formed his own band called The Quarrymen.	John Lennon	John Major	John Secada	John Bon Jovi	John Lennon
People	This John majored in philology, which triggered his interest in linguistics. This enabled him to invent 15 artificial languages. Two of them are most popular: Quenya and Sindarin, the two Elvish languages in The Lord of the Rings.	John Steinbeck	John Donne	John Tolkien	John Milton	John Tolkien
People	This John is the one who said Ask not what your country can do for you, ask what you can do for your country.	John Doe	John Smith	John Major	John Kennedy	John Kennedy
People	This John was one of the greatest English poets in the 17th century. He belonged to the group of the so-called metaphysical poets. It was his meditations that gave Hemingway the idea about the title of For Whom the Bell Tolls.	John Secada	John Tolkien	John Donne	John Milton	John Donne
People	Besides being an actor, this Pulp Fiction John is a certified pilot and owns a couple of planes.	John Goodman	John Travolta	John Wayne	John Smith	John Travolta
People	The real name of this John was Marion Robert Morrison. When his brother was born, the name Robert was given to him and the former became Marion Michael Morrison. Then he got the nickname Duke. Most sources state that his first movie was Words and Music (1929).	John Wayne	John Goodman	John Bon Jovi	John Travolta	John Wayne
People	This man is also known as Karol Wojtyla and Juan Pablo II. His reign as a Pope was the third-longest in the history of the Papacy. He named himself after his predecessor, who died suddenly after only 33 days of service to God.	John Donne	John Paul II	John Major	John Paul I	John Paul II
People	This seafarer John was captured by the Indians around 1600. He reported in his account that the Indian chief wanted to club him to death. He was saved by the 11-12 year old daughter of the chief, who stood between her father and the Englishman.	John Bravo	John Mcenroe	John Smith	John Brown	John Smith
People	This great Spanish explorer conquered what is now central and southern Mexico.	Christopher Columbus	Vasco Da Gama	Ferdinand Magellan	Hernando Cortes	Hernando Cortes
People	This mans voyages were the base for Frances claim to Canada. His initial intention was to search for the Northwest Passage to the Orient.	Marco Polo	Francis Drake	Samuel de Champlain	Jacques Cartier	Jacques Cartier
People	He is famous for sailing around the world twice. He became the first European to visit the coasts of Hawaii and Australia. Due to his voyages  some colonies were established throughout the Pacific region by several European nations.	John Franklin	Martin Frobisher	Henry Hudson	James Cook	James Cook
People	This great explorer is famous for his fulfilment of the first all water trade route between India and Europe .	Vasco da Gama	Gaspar Corte Real	Henry the Navigator	Marco Polo	Vasco da Gama
People	Along with his brother, this famous explorer reached Kaifeng, the capital of Kublai Khans Mongol Empire in 1265.	Gaspar Corte Real	Hernando Cortes	Marco Polo	Ferdinand Magellan	Marco Polo
People	This great explorer found a new continent thinking he had found a new way to India.	Hernando Cortes	Henry the Navigator	Christopher Columbus	Gaspar Corte Real	Christopher Columbus
People	This great explorer spent years searching for a seaway to China in order to trade Spains New World gold, thus contributing with information about America before its Indian cities were destroyed by foreign diseases.	John Franklin	Samuel de Champlain	John Nicolas	Hernando de Soto	Hernando de Soto
People	By his circumnavigation around the world, which took three years, from 1577 to 1580, this explorer gave a more accurate picture of the true geography of the world.	Sir Francis Drake	Christopher Columbus	Ferdinand Magellan	Horatio Nelson	Sir Francis Drake
People	He was the first man to explore Antarctica by land. He led two expeditions with the intention to find out more about the animals, weather and geology of the Antarctic.	Captain James Cook	Ferdinand Magellan	Captain Scott	Sebastian Cabot	Captain Scott
People	Famous for his sea explorations, this man helped develop the first self-contained underwater breathing apparatus (SCUBA).	Neil Armstrong	Ernest Shackleton	David Livingstone	Jacques Cousteau	Jacques Cousteau
People	People who do this job are responsible for making 3-D films look so real.  They create the hairstyles of the animated characters.	Computer Hair Stylist	Animation Hair Consultant	Hair Simulation Supervisors	Hair Care Animator	Hair Simulation Supervisors
People	What does a Wrinkle Chaser do?	Irons wrinkles from shoes	Chase wrinkles from your face	Studies the wrinkles on someones face	Performs plastic surgeries	Irons wrinkles from shoes
People	As a Banana Gasser, what gas would you use to catalyze the ripening of bananas?	Ethylene	Methyl	Helium	Saline	Ethylene
People	Are your taste buds working over time?  If so, this job might be perfect for you. John Harrison is doing this job for the Dreyers.	Candy Licker	Drugs Tester	Ice Cream Taster	Fruit Tester	Ice Cream Taster
People	Have you ever noticed that not all onions are created equal? Some are bigger, some smaller, some differ in color and this person has to sort them.	Onion Graders	Onion Janitors	Grocers	Onion Cleaners	Onion Graders
People	What does a Golf Ball Marshal do?	They carry golf sticks	They search for lost golf balls	They win golf championships	They are retired golf players	They search for lost golf balls
People	These guys provide the primary ingredient for life-saving serums to people who have been bitten by poisonous snakes.	Snake Doctors	Zoo Keepers	Snake Milkers	Snake Taxidermist	Snake Milkers
People	A Vermiculturist uses this animal to produce compost?	Worms	Flies	Ticks	Bacteria	Worms
People	Who made this popular statement in July 1969: Thats one small step for (a) man, one giant leap for mankind.?	John McKay	Neil Armstrong	Buzz Aldren	John Glenn	Neil Armstrong
People	Which US President said: I am not a crook.?	Abraham Lincoln	John F Kennedy	John Glenn	Richard Nixon	Richard Nixon
People	Ask not what your country can do for you, ask what you can do for your country. These words were delivered by which US President?	John F. Kennedy	George Washington	Richard Nixon	Abraham Lincoln	John F. Kennedy
People	Which famous boxer said that he would float like a butterfly and sting like a bee.?	Muhammad Ali	Leon Spinks	Sugar Ray Leonard	Mike Tyson	Muhammad Ali
People	Which scientist is credited with the following quote: I never think of the future - it comes soon enough.?	Sir Issac Newton	Albert Einstein	Jack Parr	Thomas Edison	Albert Einstein
People	Which famous politician said: We must all hang together, or, most assuredly, we shall all hang separately.?	Thomas Jefferson	Theodore Roosevelt	John Hancock	Benjamin Franklin	Benjamin Franklin
People	Who made a speech, known by the popular name I Have a Dream?	Willie Ricks	Roy Wilkins	Martin Luther King Jr	James Farmer	Martin Luther King Jr
People	What famous person delivered these words: I have nothing new to teach the world. Truth and non-violence are as old as the hills.?	John Hancock	Abraham Lincoln	Mahatma Gandhi	Mother Teresa	Mahatma Gandhi
People	Which fashion designer made this statement: Fashion passes, style remains.?	Paco Rabanne	Coco Chanel	Ralph Lauren	Donatella Versace	Coco Chanel
People	Which US President said the following words: Four score and seven years ago our fathers brought forth on this continent a new nation, conceived in Liberty, and dedicated to the proposition that all men are created equal.?	Thomas Jefferson	George Washington	Richard Nixon	Abraham Lincoln	Abraham Lincoln
People	Who is credited with delivering the following words: 100% of the shots you dont take dont go in.?	Larry Bird	Mike Tyson	Michael Jordan	Wayne Gretzky	Wayne Gretzky
People	These words belong to which famous writer: Always do right. This will gratify some people and astonish the rest.?	Benjamin Franklin	Charles Schultz	Mark Twain	Dr Seuss	Mark Twain
People	One of the following terrorist leaders can be described as a tall and thin man with an olive complexion and a cane, who is left-handed and always wears a plain white turban.	Abdullah Sungkar	Osama bin Laden	Tohir Yuldashev	Abu Musab al-Zarqawi	Osama bin Laden
People	The Roman emperor, Tiberius, was a left-handed ruler, who belonged to what dynasty?	Julio-Claudian dynasty	Severan dynasty	Valentinian dynasty	Flavian dynasty	Julio-Claudian dynasty
People	Raphael was a left-handed painter and architect of the Florentine school in the Italian High Renaissance. One of these works does not belong to him.	Woman with a veil (La Donna Velata)	The Marriage of the Virgin	The School of Athens	The Night Watch	The Night Watch
People	Ronald Reagan was a left-handed President.	False	True			False
People	The lefty, Henry Ford, founded the Ford Motor Company. Finish this quote and find out how he defined quality. 	...everyone is looking.	...no one is looking.	...you are told to.	...you want to.	...no one is looking.
People	Both rappers, 50 Cent and Eminem, are left-handed.	True	False			True
People	Which of these rulers / politicians was not left-handed?	Benjamin Franklin	Julius Caesar	Bill Clinton	They were all left-handed	They were all left-handed
People	During her trial, Joan of Arc was accused of being left-handed.	True	False			False
People	Nelson Rockefeller, the left-handed 41st Vice President of the United States of America, was a governor of this state before becoming Vice President.	Pennsylvania	Massachusetts	Connecticut	New York	New York
People	Jay Leno is a left-handed American comedian, who suffers from what disease?	Diabetes	Dyslexia	Mild deafness	Epilepsy	Dyslexia
People	The left-handed actor, Jim Carrey, played what character in the 2004 Hollywood production, Eternal Sunshine of the Spotless Mind?	Frank	Stan	Patrick	Joel	Joel
People	This is the last movie in which the lefty, Charlie Chaplin appeared.	The Great Dictator	Limelight	Modern Times	A Countess from Hong Kong	A Countess from Hong Kong
People	The left-handed Hollywood actor, Morgan Freeman, was born in which city?	Memphis	Nashville	Pittsburgh	Philadelphia	Memphis
People	After achieving success with his horror stories, this writer called himself Richard Bachman because he wanted to see if his novels would sell without his already famous name on them.	D.B. Wyndham-Lewis	Stephen King	Bruce Frederick Cummings	John Bingham Morton	Stephen King
People	Lewis Carroll conceived Alices Adventures in Wonderland as nursery tales for the daughter of a friend.	Charles Lutwidge Dodgson	Eugène Grindel	D.B. Wyndham-Lewis	Sue Denim	Charles Lutwidge Dodgson
People	Paul Eluard was a major exponent of surrealism.  Many of his poems reflect the hardship after his separation with his first wife Gala, who left him for Salvador Dali.	Jacques Anatole François Thibault	Lucy Beatrice Malleson	Harry Hart Frank	Eugène Grindel	Eugène Grindel
People	Besides a poet, Pablo Neruda was also a diplomat and a Communist leader.  He changed his original name because he didnt want his father to find out he was a poet.	Hector Hugh Munro	Louis Cha	Ricardo Eliecer Neftalí Reyes Basoalto	Eric Arthur Blair	Ricardo Eliecer Neftalí Reyes Basoalto
People	Anatole France was probably the most famous French man of letters of his time.  In 1921 he was awarded the Nobel Prize in Literature.	Jacques Anatole Thibault	Charles Lutwidge Dodgson	William Sidney Porter	John Dickson Carr	Jacques Anatole Thibault
People	Stendhal hated his father so he took the first opportunity to leave for Paris, where he became a lieutenant in Napoleon’s army.  He began his literary career after the fall of Napoleon in 1814.	Marie Henri Beyle	Paul M. A. Linebarger	Dan Perkins	Johann Kaspar Schmidt	Marie Henri Beyle
People	Moliere became famous as the father of French high comedy. He coined the phrase castigat ridendo mores (to criticise customs through humour) which is sometimes mistaken for a genuine Latin proverb.	Jean Baptiste Poquelin	Georges Remi	James Oliver Rigney, Jr.	Gérard Labrunie	Jean Baptiste Poquelin
